{
  "doors": [
    {
      "at": [
        5500.0,
        1420.0
      ],
      "kind": "exit"
    }
  ],
  "enemies": [
    {
      "at": [
        620.0,
        -120.0
      ],
      "facing": -1,
      "id": "enemy_scribble_grunt",
      "patrol": 420.0
    },
    {
      "at": [
        1900.0,
        -120.0
      ],
      "facing": -1,
      "id": "enemy_scribble_grunt",
      "patrol": 420.0
    },
    {
      "at": [
        3100.0,
        -120.0
      ],
      "facing": -1,
      "id": "enemy_wall_crawler",
      "patrol": 300.0
    },
    {
      "at": [
        4300.0,
        1200.0
      ],
      "facing": -1,
      "id": "enemy_stinger",
      "patrol": 500.0
    },
    {
      "at": [
        5000.0,
        1300.0
      ],
      "facing": -1,
      "id": "enemy_wall_crawler",
      "patrol": 300.0
    }
  ],
  "id": "level_01_margins",
  "keys": [
    "can_glide",
    "can_climb",
    "crouch"
  ],
  "name": "The Margins",
  "order": 1,
  "pickups": [
    {
      "amount": 12,
      "at": [
        -940.0,
        -900.0
      ],
      "kind": "ink"
    },
    {
      "amount": 12,
      "at": [
        -860.0,
        -900.0
      ],
      "kind": "ink"
    },
    {
      "amount": 12,
      "at": [
        -780.0,
        -900.0
      ],
      "kind": "ink"
    },
    {
      "amount": 12,
      "at": [
        -700.0,
        -900.0
      ],
      "kind": "ink"
    },
    {
      "amount": 14,
      "at": [
        3500.0,
        1360.0
      ],
      "kind": "ink"
    },
    {
      "amount": 14,
      "at": [
        3570.0,
        1360.0
      ],
      "kind": "ink"
    },
    {
      "amount": 14,
      "at": [
        3640.0,
        1360.0
      ],
      "kind": "ink"
    },
    {
      "at": [
        4800.0,
        730.0
      ],
      "kind": "sketch",
      "part": "arms_climber_claws"
    },
    {
      "amount": 20,
      "at": [
        4710.0,
        730.0
      ],
      "kind": "ink"
    },
    {
      "amount": 16,
      "at": [
        4830.0,
        1530.0
      ],
      "kind": "ink"
    },
    {
      "amount": 16,
      "at": [
        4880.0,
        1530.0
      ],
      "kind": "ink"
    },
    {
      "amount": 16,
      "at": [
        4930.0,
        1530.0
      ],
      "kind": "ink"
    },
    {
      "amount": 16,
      "at": [
        4980.0,
        1530.0
      ],
      "kind": "ink"
    },
    {
      "amount": 16,
      "at": [
        5030.0,
        1530.0
      ],
      "kind": "ink"
    }
  ],
  "schema": 1,
  "signs": [
    {
      "at": [
        -560.0,
        -880.0
      ],
      "size": 26,
      "text": "THE MARGINS\n\nno rebuilding past this point\nbring: claws (ink stash) · wings (sketch)"
    },
    {
      "at": [
        560.0,
        -700.0
      ],
      "size": 26,
      "text": "something lives here"
    },
    {
      "at": [
        -940.0,
        -1060.0
      ],
      "size": 26,
      "text": "claws\nonly"
    },
    {
      "at": [
        3640.0,
        -760.0
      ],
      "size": 26,
      "text": "wings\nreach the ledge"
    },
    {
      "at": [
        3600.0,
        780.0
      ],
      "size": 26,
      "text": "duck\n(ink back there)"
    },
    {
      "at": [
        4880.0,
        1000.0
      ],
      "size": 26,
      "text": "heavy?"
    },
    {
      "at": [
        5460.0,
        960.0
      ],
      "size": 26,
      "text": "out"
    }
  ],
  "spawn": [
    -420.0,
    -80.0
  ],
  "terrain": [
    {
      "kind": "solid",
      "points": [
        [
          -1150.0,
          0.0
        ],
        [
          900.0,
          0.0
        ],
        [
          900.0,
          400.0
        ],
        [
          -1150.0,
          400.0
        ]
      ]
    },
    {
      "kind": "solid",
      "points": [
        [
          1050.0,
          0.0
        ],
        [
          2400.0,
          0.0
        ],
        [
          2400.0,
          400.0
        ],
        [
          1050.0,
          400.0
        ]
      ]
    },
    {
      "kind": "climbable",
      "points": [
        [
          -1060.0,
          -760.0
        ],
        [
          -970.0,
          -760.0
        ],
        [
          -970.0,
          0.0
        ],
        [
          -1060.0,
          0.0
        ]
      ]
    },
    {
      "kind": "solid",
      "points": [
        [
          -1060.0,
          -830.0
        ],
        [
          -540.0,
          -830.0
        ],
        [
          -540.0,
          -760.0
        ],
        [
          -1060.0,
          -760.0
        ]
      ]
    },
    {
      "kind": "solid",
      "points": [
        [
          2400.0,
          0.0
        ],
        [
          3900.0,
          0.0
        ],
        [
          3900.0,
          400.0
        ],
        [
          2400.0,
          400.0
        ]
      ]
    },
    {
      "kind": "solid",
      "points": [
        [
          3400.0,
          1420.0
        ],
        [
          5800.0,
          1420.0
        ],
        [
          5800.0,
          1820.0
        ],
        [
          3400.0,
          1820.0
        ]
      ]
    },
    {
      "kind": "solid",
      "points": [
        [
          3440.0,
          700.0
        ],
        [
          3860.0,
          700.0
        ],
        [
          3860.0,
          1120.0
        ],
        [
          3440.0,
          1120.0
        ]
      ]
    },
    {
      "kind": "solid",
      "points": [
        [
          4650.0,
          800.0
        ],
        [
          4950.0,
          800.0
        ],
        [
          4950.0,
          860.0
        ],
        [
          4650.0,
          860.0
        ]
      ]
    },
    {
      "kind": "cracked",
      "points": [
        [
          4800.0,
          1420.0
        ],
        [
          5060.0,
          1420.0
        ],
        [
          5060.0,
          1490.0
        ],
        [
          4800.0,
          1490.0
        ]
      ]
    },
    {
      "kind": "solid",
      "points": [
        [
          4800.0,
          1600.0
        ],
        [
          5060.0,
          1600.0
        ],
        [
          5060.0,
          2000.0
        ],
        [
          4800.0,
          2000.0
        ]
      ]
    },
    {
      "kind": "solid",
      "points": [
        [
          5060.0,
          1510.0
        ],
        [
          5180.0,
          1510.0
        ],
        [
          5180.0,
          1910.0
        ],
        [
          5060.0,
          1910.0
        ]
      ]
    }
  ]
}
